_id,id,body,created_utc,score,parent_id,subreddit
679957c1bc2da60706169117,m90bcqk,"Geez I cannot believe how rude and judgemental ppl are reddit. But then again, internet is mostly packed with scum. 

Your idea sounds cool, but to get investment, you need to do the work to flesh out it out a lot more. For example. You need to perform market research, user research to give evidence of a willing market. You’ll also have to build a more detailed design with a grasp of the tech that might be needed and the features you’d build. Then you’d probably have to technically validate it - is it feasible, and how much will it cost. You’d build a prototype (or even a concept art) to show potential customers to gauge willingness. You’d have to have a business model and go-to-market strategy. Probably likely some metrics that show traction, like a waitlist. 

Then you put it all into a pitch deck and practice pitching. If you got rich friends and family, pitch to them first. They might even let you skip a few of these due diligence steps. If you don’t, you need to do all of it, likely with a confounding team that has a good mix of tech/business expertise and go to startup mixers to build networks into angels or apply for accelerators and VCs straight out. 

Otherwise, I highly doubt you get any investment interest in the Reddit river of scum",1737764064.0,1,t3_1i8z07w,startups
679957c1bc2da60706169118,m8xe6u5,"true, very soon bots will start adding ""I will not promote""",1737733814.0,34,t3_1i8xtfa,startups
679957c1bc2da60706169119,m8xkr2g,"So many AI startups are promoting despite the rule, saying it's not promotion because it's free, I feel like it's a breath of fresh air.

I wonder how long it'll last, but if it can leave the sub tidy, it's a full win.",1737735646.0,22,t3_1i8xtfa,startups
679957c1bc2da6070616911a,m8xgys8,"I'm not quite to the point of muting the sub. Yet. 

But I agree it's hella annoying.",1737734593.0,50,t3_1i8xtfa,startups
679957c1bc2da6070616911b,m8zx086,See you tomorrow OP.,1737759481.0,18,t3_1i8xtfa,startups
679957c1bc2da6070616911c,m8zg6e6,"We need an AI startup that will read the post, decide if it's promotional or not, and auto-moderate if so.

Of course, it would allow its own not-promotional posts, as well as those on the verified accounts whitelist, for the low, low price of $59/mo.

Investors, open your checkbooks.",1737754526.0,21,t3_1i8xtfa,startups
679957c1bc2da6070616911d,m8xagzv,Sounds to me like the guy who wants to use his AI startup to promote has left the building.,1737732758.0,40,t3_1i8xtfa,startups
679957c1bc2da6070616911e,m8zzmr4,"""I'm blocking this place!"" 

Narrator: he did not, in fact, block that place.",1737760298.0,17,t3_1i8xtfa,startups
679957c1bc2da6070616911f,m90qq6q,I am also on the edge of leaving this sub. It is seriously annoying to read it in every post.,1737769228.0,10,t3_1i8xtfa,startups
679957c1bc2da60706169120,m90skl9,"Sure, it is a bit annoying but not that bad. Just ignore it.",1737769860.0,6,t3_1i8xtfa,startups
679957c1bc2da60706169121,m91z4bd,"So annoying. Exactly what is it achieving?

If anyone wants to open another sub that doesn’t have this, I’m down to move over",1737787799.0,5,t3_1i8xtfa,startups
679957c1bc2da60706169122,m93d97u,"It’s annoying and ineffective, the people who are going to promote just slap it in the title anyway.",1737815021.0,2,t3_1i8xtfa,startups
679957c1bc2da60706169123,m90me98,"The thing is, it's very easy to skirt this rule. You just have to pose an innocuous question with an alt and then propose your solution in a comment.

Next we'll have to start all comments with ""I will not promote"" and the sub will degrade into 50 different ways to ask ""how do I split equity"" because nobody has any incentive left to share anything valuable.",1737767740.0,4,t3_1i8xtfa,startups
679957c1bc2da60706169124,m92fnsn,"What if we flip the script and instead of having every post be ""I will not promote"" we just ask people promoting something to flair ""Promotion""?",1737797927.0,3,t3_1i8xtfa,startups
679957c1bc2da60706169125,m92myan,"As someone that was banned for a year from the sub for promoting, It’s frustrating to not be able to mention what you’re working on.

The current post title requirement is obnoxious to read - What about a karma or account age minimum? At least force spammers to buy established accounts?",1737802524.0,3,t3_1i8xtfa,startups
679957c1bc2da60706169126,m90v7kh,"Nah, I support it. More subs should do it.",1737770781.0,3,t3_1i8xtfa,startups
679957c1bc2da60706169127,m923fnd,"Just make it a rule of the sub.. and warn / downvote / report / ban people for promoting.

Having it as text in every headline is repetitive and silly.",1737790312.0,2,t3_1i8xtfa,startups
679957c1bc2da60706169128,m9312fq,What are we supposed to do here? Startup theory?,1737810156.0,1,t3_1i8xtfa,startups
679957c1bc2da60706169129,m93fhqt,"If you post the story of your startup and ask a question, in the comments people will inquire for more info. You don’t break the rules answering them your startup name.",1737815817.0,1,t3_1i8xtfa,startups
679957c1bc2da6070616912a,m93q50r,Power trips are weird,1737819325.0,1,t3_1i8xtfa,startups
679957c1bc2da6070616912b,m97dbls,"Yeah, this is tedious. Rules shouldn’t have to be repeated in each post title",1737860171.0,1,t3_1i8xtfa,startups
679957c1bc2da6070616912c,m97r2pz,Im sure all of those puting that in the title will change their ways once they find out someone who doesnt read their posts in the first place has blocked the sub,1737865410.0,1,t3_1i8xtfa,startups
679957c1bc2da6070616912d,m9evhwt,"Children starving in Africa and people getting killed in wars. 

Meanwhile people in r/startups",1737959543.0,1,t3_1i8xtfa,startups
679957c1bc2da6070616912e,m90xhhi,Its a good startup opportunity. Fire up chatgpt or claude and have it write a chrome extension that removes that shit.,1737771582.0,1,t3_1i8xtfa,startups
679957c1bc2da6070616912f,m91tcby,I am also leaving the sub because of this.  It's just too jarring.,1737784666.0,2,t3_1i8xtfa,startups
679957c1bc2da60706169130,m92d5rc,I dont get the point when spammers or bots can just add the phrase to bypass getting their posts removed lol,1737796345.0,1,t3_1i8xtfa,startups
679957c1bc2da60706169131,m92x73k,[deleted],1737808343.0,0,t3_1i8xtfa,startups
679957c1bc2da60706169132,m93bpx1,"This is the most over censored useless sub in Reddit. Literally nothing useful is ever posted here because the mods are fascists (well, a specific one who thinks he should better than everyone). It’s pathetic.",1737814454.0,1,t3_1i8xtfa,startups
679957c1bc2da60706169133,m90bark,"Yeah, it’s tedious.",1737764047.0,-2,t3_1i8xtfa,startups
679957c1bc2da60706169134,m904y9a,I agree. Stupid shit. Promote lol,1737761995.0,-9,t3_1i8xtfa,startups
679957c1bc2da60706169135,m8x88a6,"hi, automod here, if your post doesn't contain the exact phrase ""`i will not promote`"" your post will automatically be removed.

*I am a bot, and this action was performed automatically. Please [contact the moderators of this subreddit](/message/compose/?to=/r/startups) if you have any questions or concerns.*",1737732116.0,-17,t3_1i8xtfa,startups
679957c1bc2da60706169136,m8x56wv,"I want to know about the economic impact to me if I decide to work on this.  

Tell me about the numbers of users you’ve talked to, the payers you’ve interviewed, the realistic size of the marketplace, etc.  everything else is colored bubbles.",1737731227.0,11,t3_1i8wx5c,startups
679957c1bc2da60706169137,m8yuw9v,"technical person here

95% of non-technical founders either radiate sketchy linkedin influencer/marketer energy or are like if your easily angered narcissistic uncle wanted you to work for him for free",1737748461.0,9,t3_1i8wx5c,startups
679957c1bc2da60706169138,m8x6g83,"Solid points made here. I'm a 3x tech founder, and I've worked with the same CEO for all 3 for the past 7 years. He brings numbers, projections and sometimes a waitlist of users. To me, that's enough to warrant energy on a 3-month MVP. Most importantly though, I understand what the project is solving for. Usually a vague 1-liner isn't enough. A mockup, wireframe, temp landing page helps a fair amount in helping to decide whether it's work the risk. ✌️",1737731599.0,7,t3_1i8wx5c,startups
679957c1bc2da60706169139,m8yulzh,"I’m non-tech and gearing up to go out to a few engineers to gauge interest in joining me as tech cofounder in the next couple of weeks. I do not have a MVP, just an idea, but I have prepared quite a bit in that I’ve essentially built out the data room that I would/will also share with investors when the time comes:

- 10 slide pitch deck
- 5 year pro forma financial model (250 rows capturing all aspects of cash flow)
- 7 page high-level roadmap/build outline
- 3 pages of product brochures
- workbook of market research (TAM/SAM/SOM, competitive analysis)
- software needs and consulting resources to utilize
- investors within my network to target
- early hiring needs and those within my network I will reach out to first
- targets for LOI’s to show interest pre-fundraise (want a tech experts input before approaching)
- initial milestones to hit over next 3 years

Also worth mentioning I have pretty deep industry experience including within a couple successful startups in the space that I joined early, which is why I think I can get away with skipping the non-funded MVP phase. We’ll see. 

Going to also start with those in my network and working at a startup in the industry for tech co-founder role, as they will likely be more receptive and knowledgeable of what I’m trying to build.",1737748379.0,3,t3_1i8wx5c,startups
679957c1bc2da6070616913a,m90u9hb,"Tech founders want committed partners, not idea merchants. I found my cofounder by already generating revenue with an MVP and proving I could sell. Built chemistry through smaller projects first, then tackled bigger challenges together.

Showing traction and execution &gt; pitching ideas.",1737770446.0,3,t3_1i8wx5c,startups
679957c1bc2da6070616913b,m93sjhg,"Technical cofounder here. Found mines on YC cofounder matching, a couple months back. Most people there are crap, but he sent me a 20 page overview doc, with tons of details. And had done 100-200h of cold calling and 30 demos.

Seeing someone put in the work and effort to validate it, goes a long way.",1737820050.0,3,t3_1i8wx5c,startups
679957c1bc2da6070616913c,m8zcfgo,"Maybe that's true. But nobody believes it anyway, because they can't imagine. Have you tried to convince Maga, have you tried to convince people there's a better way to do certain things? Most people will rather be scammed (Trump Coin etc) then trying to work on a coin, that won't be a scam. So, yes, I might haven't got a lot. But I do know what I do have. It's very rare. Because I talked to many people, I know precisely what they're lacking. They can't believe that something can be different. Thus, I don't have to rush to the exit. Don't come to me about fintech, crypto. I can sniff out immediately what the goal is. Fintech is creating the same bad reputation as crypto. Maybe you find a co-founder for example, but the weakness is still there. I am not impressed. Even though nobody looks down on my wild ideas. They chose comfy, I chose soft collision. As long as nobody believes anything, I have all the time in the world. It takes only drops to erode a stone.",1737753468.0,2,t3_1i8wx5c,startups
679957c1bc2da6070616913d,m946g88,How should non-techies approach building an MVP that would be sufficient to attract a techie? Just have money and go the India route? Have enough money and agency the whole thing through?,1737824060.0,2,t3_1i8wx5c,startups
679957c1bc2da6070616913e,m8x0ex4,"hi, automod here, if your post doesn't contain the exact phrase ""`i will not promote`"" your post will automatically be removed.

*I am a bot, and this action was performed automatically. Please [contact the moderators of this subreddit](/message/compose/?to=/r/startups) if you have any questions or concerns.*",1737729772.0,1,t3_1i8wx5c,startups
679957c1bc2da6070616913f,m8xawr5,"&gt; “Ed, it’s like dating to get married but I’m bringing my kids.” I’d never made that connection but so true.

What?! No you don't have ""kids"" yet. Or else why would you need a tech co-founder? By definition, ""founder"" means you are starting something. You are looking to build a future with someone, and maybe you have some interesting ideas about what they will create, but you haven't birthed anything yet.

Maybe you have already done market-fit and outreach, but the idea is nothing without the capacity to make it real. If a non-tech founder struggles with this concept, they will struggle to work with engineers.",1737732886.0,1,t3_1i8wx5c,startups
679957c1bc2da60706169140,m8zk0qt,"I would also add: making a low effort “I need a co-founder. What do I do?” post is NOT a good look.

Like seriously… if you can’t take 30 minutes to search and read the thousands of other posts answering this question, are people really supposed to take you seriously?

I’d love to see some more higher-effort posts where OPs actually acknowledge all the existing advice, state what they are trying and ask a more nuanced question related to how they are executing the given advice.",1737755608.0,1,t3_1i8wx5c,startups
679957c1bc2da60706169141,m90svjp,"There is pretty much noting that I cannot build, programming and even hardware. I will work for nothing but equity but I have to believe in the non tech cofounder to hold their end of the bargain. I have built too many projects which dead ended after the mvp because they non tech co founder had no clue. Build it and they will come is not a winning startup tactic.",1737769966.0,1,t3_1i8wx5c,startups
679957c1bc2da60706169142,m921l8l,"Agree 100%.. We technical guy not / will support the ""ACTUAL COST"" of development. YOU NEED money for your idea. Did we try  no money .YEAH. success no. Conclusion, have money first and then PLAN your idea.",1737789210.0,1,t3_1i8wx5c,startups
679957c2bc2da60706169143,m8x2woi,"Wait, hold up. You’re telling me you have a timer going every day just tick-tocking away like a bomb in an action movie? That sounds like a mental breakdown waiting to happen. Life ain't an Olympic race. Relax and scroll TikTok all day.",1737730541.0,5,t3_1i8vj8g,startups
679957c2bc2da60706169144,m8woisd,"hi, automod here, if your post doesn't contain the exact phrase ""`i will not promote`"" your post will automatically be removed.

*I am a bot, and this action was performed automatically. Please [contact the moderators of this subreddit](/message/compose/?to=/r/startups) if you have any questions or concerns.*",1737725794.0,1,t3_1i8vj8g,startups
679957c2bc2da60706169145,m8wmjiz,"First of all, congrats on your PhD! I’ve worked in a few startups already, so here’s how I approached it:

Honestly, it’s pretty similar to finding a corporate job, but it relies way more on networking. I attended startup events and kept an eye out for startups that sounded interesting to me. I’d ask the founders directly if they were looking for employees and where I could apply. Most of the time, they’d tell me to apply through their website, but sometimes they’d give me their personal email instead.

Another job I landed at a startup was through my previous experience at a VC. VCs know which of their portfolio companies are looking for talent, so they’ll sometimes recommend you to hire directly.

Hope that helps!",1737725081.0,15,t3_1i8uvxv,startups
679957c2bc2da60706169146,m8wt85a,Try out angellist,1737727422.0,10,t3_1i8uvxv,startups
679957c2bc2da60706169147,m8wnnxd,Follow folks working at YC and a16z- they’re always posting giant lists of salaried openings at companies in their portfolios!,1737725488.0,6,t3_1i8uvxv,startups
679957c2bc2da60706169148,m8yxa9w,What's your PhD in?,1737749149.0,3,t3_1i8uvxv,startups
679957c2bc2da60706169149,m8x0qfp,"1. Go to https://breakoutlist.com/ - if you find one that fits your interests
2. Seedtable to look for specific city / country
3. VC portfolios. Find VCs on crunchbase for example or on https://signal.nfx.com/


On how you do it: try to fix something on their product and send it to them without any expectations. Then if they respond you can try to apply they way directly.",1737729872.0,2,t3_1i8uvxv,startups
679957c2bc2da6070616914a,m8x2zam,"Try looking into local startup hubs or tech incubators in your area. They often have job boards for small startups. Networking events can also be gold; founders often attend to find talent. It's more footwork, but you might find that gem you're looking for!",1737730563.0,2,t3_1i8uvxv,startups
679957c2bc2da6070616914b,m8x550y,In my opinion the best way to find startups is with crunchbase. You can get free 7 days trial and directly cancel it if you want. The platform shows all startups which were recently funded or even a while ago. If you are from Germany I can recommend startup insider. Otherwise you can find a lot of startups via the websites of venture capital funds. Just go to any VC’s website and go to their portfolio. There you will see a bunch of startups.,1737731212.0,2,t3_1i8uvxv,startups
679957c2bc2da6070616914c,m8zx29x,"Techstars portfolio companies put loads of jobs on https://jobs.techstars.com/ - 3,530 listed when I just checked. 

And congrats on your PhD!!!",1737759499.0,2,t3_1i8uvxv,startups
679957c2bc2da6070616914d,m9256pd,A good advice I can give is; search websites of VCs or accelators. Then search in their portfolio for the job and roles you seek.,1737791386.0,2,t3_1i8uvxv,startups
679957c2bc2da6070616914e,m9e9ass,Try the job placement centers of major SF Bay area universities. Tons of startup opportunities.,1737949648.0,2,t3_1i8uvxv,startups
679957c2bc2da6070616914f,m8wj4go,"hi, automod here, if your post doesn't contain the exact phrase ""`i will not promote`"" your post will automatically be removed.

*I am a bot, and this action was performed automatically. Please [contact the moderators of this subreddit](/message/compose/?to=/r/startups) if you have any questions or concerns.*",1737723795.0,1,t3_1i8uvxv,startups
679957c2bc2da60706169150,m8wv5h6,"Congratulations on the PhD! Having been in the startup world my whole career, 30 years now, networking is usually the best route to take. Your alumni network is a good place to start, along with seeing what startups are related to the university where you got your PhD. The first startup I joined was doing work at the university where I was getting my PhD, so I approached them to see if they needed an engineer. At the time, they were contracting work at the university that was very similar to what I was doing for my thesis. I got hired as their first full-time employee.

Wellfound is a site where startups will post jobs. Many VCs will also post jobs available at their portfolio companies. You can also check LinkedIn. Many times, though, due to the potential high costs of recruiting, startups will hire through word-of-mouth. Which comes right back to networking!

Considering you have a PhD, then you likely have specialized knowledge and experience that will fit really well with the right startup. Take a targeted approach to finding those startups where your skill set will be invaluable. Even if they don't have a job posted, it can't hurt to contact them. Maybe you can initially consult with them and eventually get hired. This is how I got my 2nd startup job.

Good luck!",1737728071.0,1,t3_1i8uvxv,startups
679957c2bc2da60706169151,m8wx96x,"[https://en.wikipedia.org/wiki/May\_you\_live\_in\_interesting\_times](https://en.wikipedia.org/wiki/May_you_live_in_interesting_times)

What you call interesting sometimes involve more drama than in the Housewives of-franchaise, with you (as a non-founder) sitting there like an unwanted child getting weaponized/abused during an epically bad divorce by a group of polyamorous drunkards.

That whole ""they can pay a salary""-thing is a watershed moment that you ideally want to happen after you've joined, so that you don't end up as just one of many new recruits after they've raised a lot of money (when there's lots of new people with no established company culture etc). Or, you want the business to already have stabilized with decently sized teams, but that's probably beyond what you'd call an interesting time; so you'd be back to simply doing a regular job.

My most helpful advice would be to network within your local startup scene. Get a feel for what's out there, whom to trust, and hopefully get noticed by some investors that would want your particular skills to help strengthen a business that they've already invested in.

As always, start with [meetup.com](http://meetup.com) and see where that takes you.",1737728758.0,1,t3_1i8uvxv,startups
679957c2bc2da60706169152,m8x00m5,Lots of venture funds list jobs in their portfolio companies. It's a good place to start,1737729646.0,1,t3_1i8uvxv,startups
679957c2bc2da60706169153,m8x8df8,"YC startups have their jobs posted on https://www.workatastartup.com, it’s a pretty convenient place to find and apply to startups.

Also, if you know a specific field you want to work in you can find startups in the field and most will have job postings in their websites",1737732158.0,1,t3_1i8uvxv,startups
679957c2bc2da60706169154,m8xblw1,"Related question: I am looking for a co-founder, would I find a cofounder in startup events or should I first find a cofounder before joining those? I am now planning for an ad on LinkedIn but I think I will have little success there (especially in my region, Hong Kong).",1737733086.0,1,t3_1i8uvxv,startups
679957c2bc2da60706169155,m8xsdzi,VC's usually shares who they invest in on social media like Linkedin. Go to different VC's on Linkedin and scroll through posts to see wich companies they havce invested in. Another way is to look at their portfolio than search for the companies at linkedin and contact them.,1737737739.0,1,t3_1i8uvxv,startups
679957c2bc2da60706169156,m8y9d1m,"wait i thought ""i will not promote"" was some kind of meme joking about the flair. is that an actual requirement now? what the fuck is going on?",1737742438.0,1,t3_1i8uvxv,startups
679957c2bc2da60706169157,m8z4rah,HiringCafe lets you select companies in various series,1737751294.0,1,t3_1i8uvxv,startups
679957c2bc2da60706169158,m8zpgu1,YC's hiring site is quite literally called 'workatastartup.com'.  This is where many YC backed startups post open roles.,1737757199.0,1,t3_1i8uvxv,startups
679957c2bc2da60706169159,m90owyz,"bro, you’ve got a phd and you’re asking basic stuff? ever heard of Google? there are tons of platforms out there with startup gigs, like AngelList or Y Combinator. but let's be real, if you’re serious about escaping corporate hell, start networking, for real. hit up LinkedIn, hit those forums, go to startup meetups. or just straight up contact startups and beg lol. they're easier to reach than you think. and don’t expect startup life to be all fun and games; it ain’t a walk in the park. longer hours, more stress, but sure, maybe less boring than your average corporate job. so yeah, good luck with that.",1737768604.0,1,t3_1i8uvxv,startups
679957c2bc2da6070616915a,m8y4ebm,"Save up for a little while then work for no money. You have a Phd, you can always go back to corp if you need the cash, but the oportunity to work on somthing legitimately interesting is worth taking a short term financial hit. Also, working at an early stage startup you should be able to haggle your way into a title/job that's well in advance of where you are in the corp world. If it falls apart after ~3 years (as many do) when you go back to the job hunt you'll be doing it with a much more advanced title. Working at a start up is a great way to leapfrog people in more stable corporate life who tend to experience much slower role advancement.",1737741065.0,0,t3_1i8uvxv,startups
679957c2bc2da6070616915b,m90839t,"What is this type of problem? I see it via smart enough to make 3x rent, can’t suss out where to live/find an apartment. Smart enough to finish a PHD but can’t type “work at start up” in Google which garnered the following results…


- https://www.workatastartup.com/

- https://startup.jobs/

- https://builtin.com/

- https://www.linkedin.com/jobs/startup-jobs-dallas-tx",1737763002.0,0,t3_1i8uvxv,startups
679957c2bc2da6070616915c,m8wqq7k,"If you live in a popular area like San Francisco or Salt Lake City, local conferences and chamber of commerce events always have networking opportunities. I was stunned at the amount of opportunities I had to work for start ups by attending conferences like door-to-door sales conference in SLC a few weeks ago. Go find conferences or public events where companies have booths and start taking names. Hope this helps!",1737726568.0,-1,t3_1i8uvxv,startups
679957c2bc2da6070616915d,m8w3m4k,"hi, automod here, if your post doesn't contain the exact phrase ""`i will not promote`"" your post will automatically be removed.

*I am a bot, and this action was performed automatically. Please [contact the moderators of this subreddit](/message/compose/?to=/r/startups) if you have any questions or concerns.*",1737716475.0,2,t3_1i8swit,startups
