_id,id,body,created_utc,score,parent_id,subreddit
6799340f3474f2d0be95d4a8,m9oovfx,"hi, automod here, if your post doesn't contain the exact phrase ""`i will not promote`"" your post will automatically be removed.

*I am a bot, and this action was performed automatically. Please [contact the moderators of this subreddit](/message/compose/?to=/r/startups) if you have any questions or concerns.*",1738091274.0,1,t3_1ic9ewr,startups
6799340f3474f2d0be95d4a9,m9oqu3p,"Went through Techstars San Diego last September.

As a first time founder (been in Tech for 6 years before that), i I could’ve not learned more in such a short time and also built a great network.
You learn how to to build, connect and raise. You’ll meet great mentors and other founders. Finally, for your next round Techstars is a badge that gives them a little bit of validation. 

So my (simplified) advise is: if you are all first time founders, do it. 

Otherwise, don’t.",1738091814.0,1,t3_1ic9ewr,startups
6799340f3474f2d0be95d4aa,m9oc7hv,"hi, automod here, if your post doesn't contain the exact phrase ""`i will not promote`"" your post will automatically be removed.

*I am a bot, and this action was performed automatically. Please [contact the moderators of this subreddit](/message/compose/?to=/r/startups) if you have any questions or concerns.*",1738087825.0,1,t3_1ic7zjv,startups
6799340f3474f2d0be95d4ab,m9o5tsq,"Hi ChatGPT


You see the new DeepSeek yet?",1738086087.0,3,t3_1ic72za,startups
6799340f3474f2d0be95d4ac,m9oguqz,Nice good read,1738089087.0,2,t3_1ic72za,startups
6799340f3474f2d0be95d4ad,m9o456j,"hi, automod here, if your post doesn't contain the exact phrase ""`i will not promote`"" your post will automatically be removed.

*I am a bot, and this action was performed automatically. Please [contact the moderators of this subreddit](/message/compose/?to=/r/startups) if you have any questions or concerns.*",1738085623.0,1,t3_1ic72za,startups
6799340f3474f2d0be95d4ae,m9o474i,"[Read the original](https://paynpoint.substack.com/p/building-in-the-open-in-2024)

[Posting my content like this is fine, according to a mod.](https://old.reddit.com/r/startups/comments/1i436ss/the_sub_is_losing_its_value/m7yb8k4/)",1738085638.0,1,t3_1ic72za,startups
679934103474f2d0be95d4af,m9oepnv,"Sir, why do u help without any expectations or benefits? Or is it really like that?",1738088506.0,2,t3_1ic72lz,startups
679934103474f2d0be95d4b0,m9o41xi,"hi, automod here, if your post doesn't contain the exact phrase ""`i will not promote`"" your post will automatically be removed.

*I am a bot, and this action was performed automatically. Please [contact the moderators of this subreddit](/message/compose/?to=/r/startups) if you have any questions or concerns.*",1738085598.0,1,t3_1ic72lz,startups
679934103474f2d0be95d4b1,m9oicwp,"I am building [HappyLoop](https://www.happyloop.com/), it's the hardest thing I have every done in my life. The first time I am building a startup, in a completely new category where I'm the only player, with 0 sales experience. I have finally cracked the outreach game, but mentally there are very tough days.",1738089497.0,1,t3_1ic72lz,startups
679934103474f2d0be95d4b2,m9nnowo,"hi, automod here, if your post doesn't contain the exact phrase ""`i will not promote`"" your post will automatically be removed.

*I am a bot, and this action was performed automatically. Please [contact the moderators of this subreddit](/message/compose/?to=/r/startups) if you have any questions or concerns.*",1738080988.0,2,t3_1ic575w,startups
679934103474f2d0be95d4b3,m9nl1w1,"hi, automod here, if your post doesn't contain the exact phrase ""`i will not promote`"" your post will automatically be removed.

*I am a bot, and this action was performed automatically. Please [contact the moderators of this subreddit](/message/compose/?to=/r/startups) if you have any questions or concerns.*",1738080239.0,1,t3_1ic4whx,startups
679934113474f2d0be95d4b4,m9ngszv,"hi, automod here, if your post doesn't contain the exact phrase ""`i will not promote`"" your post will automatically be removed.

*I am a bot, and this action was performed automatically. Please [contact the moderators of this subreddit](/message/compose/?to=/r/startups) if you have any questions or concerns.*",1738079014.0,1,t3_1ic4ewu,startups
679934113474f2d0be95d4b5,m9ndu77,"Your experience will be getting banned from mainstream platforms. You will have to use a shady tool where they cycle through IPs to burn and you will be doing black hat work.

Calling it a cold list is a sleazy way of saying you’re emailing people who have not opted in. You are sending spam. You are breaking CAN-SPAM rules. You are breaking the rules of the email clients and the ESPs.

You will have very low deliverability rates, you will have high spam reports, and the few responses you get will likely be about it being spam.

I have worked with a variety of stupid, stupid, stupid clients in my career who heard that cold emails are the most amazing thing ever.

If they had put 1/10th of the effort they spent sending crappy unsolicited emails out on doing it right, they would have seen success. They did not.",1738078149.0,8,t3_1ic3fnt,startups
679934113474f2d0be95d4b6,m9nekhy,"Just don’t cold email consumers. Create a lead magnet, gather opt in emails, create a drip campaign, build landing pages that convert and utilize social media. 

You can also leverage your network and be a self promoter within it. 

Cold emailing random consumers is not only going to get you marked as spam and your domain possibly blocked, but most consumers aren’t using email as much these days. It’s not a high value outbound tactic for consumer driven apps.",1738078363.0,3,t3_1ic3fnt,startups
679934113474f2d0be95d4b7,m9nayla,How do you avoid getting sued under the CANSPAM act?,1738077297.0,2,t3_1ic3fnt,startups
679934113474f2d0be95d4b8,m9ns0gu,"My experience from a hundred plus emails, no links, domain email, multiple, sent in small batches to prevent being flagged:  basically 0 conversions (people looking at the material), based on analytics. And I am targeting very specifically entities that should potentially be interested.",1738082201.0,2,t3_1ic3fnt,startups
679934113474f2d0be95d4b9,m9n838q,"hi, automod here, if your post doesn't contain the exact phrase ""`i will not promote`"" your post will automatically be removed.

*I am a bot, and this action was performed automatically. Please [contact the moderators of this subreddit](/message/compose/?to=/r/startups) if you have any questions or concerns.*",1738076410.0,1,t3_1ic3fnt,startups
679934113474f2d0be95d4ba,m9n99gw,"If you're using MailChimp, then you're talking about something more like a newsletter than a cold email. MailChimp expects that the emails you have specifically opted in to be in your list. Do you have such an email list? ",1738076776.0,1,t3_1ic3fnt,startups
679934113474f2d0be95d4bb,m9opfmd,Cold emails?  I heard of Mailchimp.  That’s cool.  How many emails? 🤔,1738091428.0,1,t3_1ic3fnt,startups
679934113474f2d0be95d4bc,m9n6fwh,"VRBO is an actual competition to Airbnb. Their strength comes from their ownership (Expedia) and the capital, marketing and patience that provides",1738075892.0,7,t3_1ic30xm,startups
679934113474f2d0be95d4bd,m9n5sqm,"my personal opinion is that there are competitors to airbnb out in the marketplace now.  The problem is getting scale.  How do you get scale in a competitive marketplace?  Typically prices get lowered, so it becomes a race to the bottom.  Is that a good use of time, effort, energy?",1738075688.0,3,t3_1ic30xm,startups
679934113474f2d0be95d4be,m9n7ayy,"Absolutely. But you need to target a specific micro market then move on.  Pigeon forge TN would be a perfect market as that whole area is designed for cabins and many companies with a few dozen cabins will have their own booking page and they do all the marketing.   

You can come in there with a zero or low booking fee and they'll all add your app to their booking.   Integrate with the other software so it blocks off and schedules automatically then you're set.    Renters will use your app because it'll be 10-30% cheaper than Airbnb. 

But you need millions in SEO and marketing to capture those renters.  Once you steal that market you move to the next one. 

This is a long term plan where you'll be losing millions every market and won't ever be able to charge as much as Airbnb.  You're basically capturing some of their market share and bringing down the profit for everyone.   But outside of marketing there isn't much overhead as it's just a website that runs itself.   Airbnb and all others shouldn't be more than 5% markup.",1738076164.0,2,t3_1ic30xm,startups
679934113474f2d0be95d4bf,m9n4hop,"hi, automod here, if your post doesn't contain the exact phrase ""`i will not promote`"" your post will automatically be removed.

*I am a bot, and this action was performed automatically. Please [contact the moderators of this subreddit](/message/compose/?to=/r/startups) if you have any questions or concerns.*",1738075272.0,1,t3_1ic30xm,startups
679934113474f2d0be95d4c0,m9n6dcr,"It's possible. But you would need to identify a real opportunity that was somehow defensible. 


You have to figure out what would you be able to offer to people that is so great they'd be willing to put up with all the drawbacks of using a new product instead of an established one. ",1738075870.0,1,t3_1ic30xm,startups
679934113474f2d0be95d4c1,m9nav4u,Sure there is. But hyper niche/hyper targeted to either a) specific consumer groups/demos or b) industry specific - for example: business travelers of certain industries that have different needs than the typical airbnb consumer - the good news?  These people have deeper pockets!,1738077268.0,1,t3_1ic30xm,startups
679934113474f2d0be95d4c2,m9nebsv,"Short term rentals are so thorny (between bad owners, bad renters, and regulatory pressure) that I doubt someone starting from scratch would be able to break in without a huge war chest. I feel like it’s the same thing with Uber and food delivery apps.

In a market that doesn’t require as much capital I feel like you could do better. Like look at what Smartsheet was able to steal from Microsoft, or Figma from Adobe.",1738078293.0,1,t3_1ic30xm,startups
679934113474f2d0be95d4c3,m9ni7cm,"Everyone fails. Sooner or later.

AirBnB may be big, but there are important backlash movements against it. And they probably cater to a majority of tourists, but not to niche markets. And that's very likely where the next big guy will come from.

Especially when the niche is not a niche anymore.",1738079416.0,1,t3_1ic30xm,startups
679934113474f2d0be95d4c4,m9njjup,"Booking has individual hosts posting as well. They're not only for hotels.

But short term rental is no longer lucrative and many local governments ban it.",1738079810.0,1,t3_1ic30xm,startups
679934113474f2d0be95d4c5,m9oeyym,"Another thing to consider is geography. If you look at a company like Grab or DiDi they basically do everything that uber / ubereats does but in geos where uber is locked out. 

Airbnb / vrbo has already proved there’s an appetite, and people aren’t THAT different across the world. I would agree with the other commenters that competing in the U.S. market would be difficult, but that doesn’t mean that you couldn’t build a xxx million dollar company in other parts of the world.",1738088577.0,1,t3_1ic30xm,startups
679934113474f2d0be95d4c6,m9on979,There are plenty of thriving regional variants of Airbnb,1738090829.0,1,t3_1ic30xm,startups
679934113474f2d0be95d4c7,m9owag0,"There is always room for competitors because no company can serve everyone.

Turn high end motels into BnBs

Create a mobile app version entirely powered by AI so people can find only exactly what they want (directories are bad user experiences)

Be a curated experience only features specific homes in specific places, accompanied by a tour guide and tickets to things to do

Make it experiential and tie it to music, with in home life performances",1738093302.0,1,t3_1ic30xm,startups
679934123474f2d0be95d4c8,m9mukwi,"There are missing chapters for a 30 years trajectory, and some speed ran over - it’s intriguing. 

Starting 4x other companies while being VC funded is a significant, puzzling part of your story.",1738071913.0,25,t3_1ic1lm8,startups
679934123474f2d0be95d4c9,m9mulom,"This is an interesting read.   
  
Your career shows a consistent commitment to following your gut, even when it meant walking away from money or facing uncertainty. I am not sure if I would be able to do everything you said above.   
  
So looking back, what specific mindset or habit helped you stay confident in those moments of doubt, especially when every external voice was telling you to choose the safe route?",1738071921.0,6,t3_1ic1lm8,startups
679934123474f2d0be95d4ca,m9mv8so,"""Focus on a single, funded opportunity and just pursue that"" lol yeah same here. While I'm working on my pre-revenue startup, I met other veterans and was inspired to start a startup accelerator for veterans. Been slow going especially with no reputation besides the connections I've been making with other founders that the main investor has invested in, but I'm pursuing both at the same time. It's not being bored with an idea, it's just having passion about your ideas so much.",1738072149.0,4,t3_1ic1lm8,startups
679934123474f2d0be95d4cb,m9mu3s5,"&gt; slaving for clients I didn't enjoy with a mission I simply didn't care about

Thanks for sharing a honest story! This sentence just hit me as I am about to leave my employer. I just don’t care about their type of clients. Never looked at it this way, I always thought the type of company or work is what matters. But their just don’t excite me. I need to think more about that.",1738071743.0,3,t3_1ic1lm8,startups
679934123474f2d0be95d4cc,m9mzgat,"Good evening,  
  
I am a student of Physics Honors. Over the past several years, I have been studying climate change in depth, understanding its physics, mathematics, economic impact, societal effects, and much more.  
  
I am currently working on a unique solution that, when sprayed from the sky using simple hydrogen balloons or agriculture aircraft, can sequester CO2 with very low activation energy. This solution will not only capture CO2, but it will also store it for millennia in solid form once it falls to the ground. Additionally, it has the potential to enrich the soil and benefit both humans and the environment, without causing any harm.  I have been studying in detail how carbon dioxide and other greenhouse gases (GHGs) absorb heat through various modes, such as rotational at 2.3 micrometers, bending at 4.2 micrometers, and symmetric at 15.3 micrometers. Additionally, I have explored how the vibrational energy of these bonds is transferred to other molecules, like oxygen and nitrogen, through conduction, among other processes.  
  
I have delved deeply into this subject and have developed a specific solution of calcium hydroxide with 72.6% humidity. When this solution is sprinkled, particularly, it has minimal activation and quickly binds with CO2 in the air to form calcium carbonate (2.2 grams per square meter but depends on the ppm and other factors too). This process is environmentally friendly and offers benefits to both the environment and human health, as it is naturally occurring. By reducing the concentration of CO2 in cities—where levels are around 820 ppm—this solution can lower CO2 levels to approximately 258 ppm, effectively cooling the environment naturally and contributing to temperature reduction, along with several other advantages like providing a natural humidity to the human body and other living beings.  
  
I plan to file a patent for this and need to publish my research paper. I am conducting this study independently and require some necessary instruments like infrared gas sensors to obtain precise experimental readings. These instruments will be crucial in proving the effectiveness of my solution and in convincing others that it works.  
  
What should I do to complete it? It has become a paradox. To create a prototype and conduct experiments for research, you need funding, but to secure funding, you need a prototype, patents, or research that is ready for implementation. I need around $218. I’m not sure about other countries, but here, it’s a significant amount, and no one is willing to provide it as a grant.",1738073611.0,3,t3_1ic1lm8,startups
679934123474f2d0be95d4cd,m9nelkz,"I kind of did a you 'road less travelled' then to a more conventional safe job, now back in to treacherous territory, love it and hate it, avoiding VCs as much as possible but shit, doing anything significant when you come from nothing and don't have capital readily available is near impossible.",1738078372.0,3,t3_1ic1lm8,startups
679934123474f2d0be95d4ce,m9nndqo,""" but I live in more fear of regret than failure.""

This is my motto.  I translated it to never having shoulda, woulda, coulda.

Thank you for an insight into your world.  As a woman, this is helpful and motivating.

Bootstrapping my idea is more of a declaration that I can and will do it.",1738080900.0,2,t3_1ic1lm8,startups
679934123474f2d0be95d4cf,m9ms9ak,"hi, automod here, if your post doesn't contain the exact phrase ""`i will not promote`"" your post will automatically be removed.

*I am a bot, and this action was performed automatically. Please [contact the moderators of this subreddit](/message/compose/?to=/r/startups) if you have any questions or concerns.*",1738071074.0,1,t3_1ic1lm8,startups
679934123474f2d0be95d4d0,m9n7lgh,"It’s commendable that you remain humble enough to contribute to this sub with the insights of such a successful Founder. 

I have spent the last 8 years as a founding employee (not technically a Founder from a title perspective), and have endured the few highs and many lows that come with the territory. I’ve been primarily in ops roles, launching and managing commercial, fundraising ($25M raised), finance, BD, People, partners, etc. 

I’m at a point in my journey where it’s hard for me to contribute to a larger company (1000+ employees) as I’m not a specialist in a given area, but don’t have the technical expertise, or suitable concept, to launch my own startup. 

My optimal next step is to partner with a startup that has a product in concept stage but requires the foundation and framework to build the company around it through the early stages of growth. However, I’m a bit stuck on how to proceed. 

What would you recommend I focus on to position myself to either join a post-PMF/growth stage org as COO (or similar, not title hungry), or find a technical founder who needs a business partner to proceed through pre-seed/seed and beyond?",1738076255.0,1,t3_1ic1lm8,startups
679934123474f2d0be95d4d1,m9n9r21,"I can really relate to your post: the running many things in parallel, being unemployable for similar and different reasons (graduated from a top 10 school but cant get a decent job lol), the straddling of funded vs bootstrapped, the weight of morals, ethics and values that can significantly alter your course etc). 

Recently, I've started a company for interest-driven education of students. Its currently bootstrapped. But in all honesty, I don't know what I am doing. I have no idea how to scale, or even how to run a company. I feel like any x iterations of products I come up with are meaningless derivatives of existing successful ideas. I constantly feel like a sham. I feel as though I have to come up with something groundbreaking to be relevant/successful in this field. I have a vision of what I want. But nothing tangible to show for it. 

Have you faced anything similar? How do you deal with imposter syndrome? Did you take courses to learn how to run a company or have direct relationships with successful mentors?",1738076929.0,1,t3_1ic1lm8,startups
679934123474f2d0be95d4d2,m9nfi5q,"The guidance counselor experience really resonates with me. I high school, I wanted to be a TV news anchor. I think it’s exactly the right level of celebrity to have a really great life. 
When i asked the counselor, she said only a small percent of applicants get reporter jobs. So I went into Sales. 
Later I dated a news reporter and found out the counselor’s advice was well-meaning but ill-informed. To learn about a job, talk to people who have that job.",1738078637.0,1,t3_1ic1lm8,startups
679934123474f2d0be95d4d3,m9nh4aq,very cool journey!,1738079103.0,1,t3_1ic1lm8,startups
679934123474f2d0be95d4d4,m9o12tj,"I think this might be the most interesting post I've seen on this subreddit so far in a see of burning trash.

Anyway, you came up through a pivotal time and I'm curious what your view is on the current state of VCs, startup behavior of being in the red for so long (if ever being profitable), and whether it's even worth trying to get funded vs. bootstrapping?

I'm personally bootstrapping because I believe in the ""benevolent dictator"" idea and having too many cooks ruins the dish.",1738084775.0,1,t3_1ic1lm8,startups
679934123474f2d0be95d4d5,m9o7kot,"Wow, this post really resonates with me, especially the part about not taking the ""safe route."" your path is really amazing, and thanks for sharing with us here as an example!   
  
when I worked as a designer, I’ve always found that bold decisions—whether it’s bootstrapping or going against traditional paths—tend to yield the most creative and rewarding results. It’s like typography: you can play it safe with Helvetica, but sometimes something experimental or bespoke makes all the difference. 

Now that I'm a bootstrapped founder building Typogram, bootstrapping feels similar to me; it lets you maintain creative control with your path whereas the funded path feels a little more traditional. Sure, there are risks, but it’s often those risks that create the space for truly standout success.",1738086564.0,1,t3_1ic1lm8,startups
679934123474f2d0be95d4d6,m9ou566,survivor_bias_airplane.jpg,1738092717.0,1,t3_1ic1lm8,startups
679934123474f2d0be95d4d7,m9mxiti,"My (non-representative) research shows that reaching 100 people will lead 1-5% to your page, and 2-5% of them will become actual customer (in the near future). Of course you can improve these ""lead"" and ""conversion"" rate to better figures, but these are ""just"" the nuances in marketing, so don't be sad about numbers.

Do you have 98 followers? It is 98 more than most of the ""I have a great idea"" founders has. Use it as a positive feedback on your effort in coming up with an idea and setting up Instagram for it. Don't give up on your plans now. As others said try different channels, identify your prospects and talk to them. Be the biggest fun of your own product and your enthusiasm will sell it.",1738072946.0,2,t3_1ic13mb,startups
679934123474f2d0be95d4d8,m9ntr54,"No one will pay attention if you don’t have at least a MVP, because ideas alone aren’t enough to capture interest. People need something tangible to evaluate.",1738082686.0,2,t3_1ic13mb,startups
679934123474f2d0be95d4d9,m9mo7s2,"hi, automod here, if your post doesn't contain the exact phrase ""`i will not promote`"" your post will automatically be removed.

*I am a bot, and this action was performed automatically. Please [contact the moderators of this subreddit](/message/compose/?to=/r/startups) if you have any questions or concerns.*",1738069536.0,1,t3_1ic13mb,startups
679934123474f2d0be95d4da,m9mrf5w,"No, don’t give up. I think if you give it time and effort, it could really end up amazing. Keep up and don’t give up.",1738070763.0,1,t3_1ic13mb,startups
679934123474f2d0be95d4db,m9msmju,"You've run into a realisation that most founders run into when they try their first idea: The idea matters less than your Go-to-market. How do you actually find customers? Sounds like Instagram might not be the best channel. You mentioned that you work in a dental office yourself. Where do you get info about new equipment like this? You also mentioned other dentists you talked to. Ask them the same question. This might be conferences, magazines, ...

Then try to market via _these_ channels and see if you can get traction. If you still can't, then maybe the pain isn't big enough.

Also, if you haven't yet, read ""The Mom Test"", it covers this initial research phase quite well.",1738071209.0,1,t3_1ic13mb,startups
679934123474f2d0be95d4dc,m9oky1v,you need a good marketer,1738090199.0,1,t3_1ic13mb,startups
679934133474f2d0be95d4dd,m9mr3ty,"I am looking for a non-technical, business oriented co-founder. Based in Europe though. Mobile app, built and published.",1738070645.0,3,t3_1ic0r46,startups
679934133474f2d0be95d4de,m9mqli8,"What languages do you specialize in?

** Edit- if any in addition to Flutter and React!",1738070455.0,2,t3_1ic0r46,startups
679934133474f2d0be95d4df,m9mxqdu,What relevant industry experience are you looking for?,1738073019.0,2,t3_1ic0r46,startups
679934133474f2d0be95d4e0,m9n78ye,What does I will not promote mean?,1738076147.0,2,t3_1ic0r46,startups
679934133474f2d0be95d4e1,m9mlfgx,"hi, automod here, if your post doesn't contain the exact phrase ""`i will not promote`"" your post will automatically be removed.

*I am a bot, and this action was performed automatically. Please [contact the moderators of this subreddit](/message/compose/?to=/r/startups) if you have any questions or concerns.*",1738068397.0,1,t3_1ic0r46,startups
679934133474f2d0be95d4e2,m9mzmgk,"I mean… I’ve got an idea I need an app for if your interested. I’m from Cleveland and a computer engineer with 6+ years of experience in Electrical, and software development. I’m looking to find people as smart or smarter than I am. The app is only a piece of the larger puzzle. Lmk if ur interested.",1738073669.0,1,t3_1ic0r46,startups
