_id,id,body,created_utc,score,parent_id,subreddit
679934223474f2d0be95d621,m9c6k8c,"Sales. You can reach any time fiverr or similar collaborators (even here on reddit) to finish projects and you get a good margin if it's too much for you.

Having clients is more important.",1737927282.0,1,t3_1iak4e3,startups
679934223474f2d0be95d622,m9c8fdi,"I would try Y Combinator's Founder Matching platform. I'm also non-technical and have met with more than two dozen potential co-founders. It feels a lot like setting up a dating profile, but for starting a startup. Also, I highly recommend YC's free ""founder school"" curriculum. ""I will not promote.""",1737927781.0,1,t3_1iak4e3,startups
679934223474f2d0be95d623,m9f47jt,Don’t post here- it’s anti-start up by virtue of making you pledge ‘no promotion’. Ugh!,1737964580.0,1,t3_1iak4e3,startups
679934223474f2d0be95d624,m9j2go1,"&gt; *I am strong on requirement gathering, feature building and wire framing. I can blueprint whole app out of a idea but the problem is actually I cant code and dont have technical knowledge.*

This was me 10 years ago.  Dealt with flaky coders and cofounders for years. I always told myself I couldn't code.

Then finally I had it.  The last straw.  Spent 6 months building what would be called an MVP these days, and the day after launch, my cofounder got a job and ditched the project.

I spent the next 6 months learning to code, and never looked back.  

So yes. I vote for option 1. You can do it.  Learn to code.  Don't be at the mercy of anyone else.

Calacanis said repeatedly that you just need to be 70-80% good at a lot of things, not 100% on anything.  Do the best you can, people don't expect perfection to start.",1738015109.0,1,t3_1iak4e3,startups
679934223474f2d0be95d625,m9l69x7,"If you have a friend who's technical and who wants to start a startup someday, get him/her onboard. Don't think of being non-technical as a liability. Your responsibilities will be much different - you'll be doing product, sales, fundraising, etc &amp; he/she will be writing code.

And don't think quarterly! That's a terrible mistake. Just finalise a problem statement and get a prototype built in 2-3 weeks and you'll know what to do from there...

All the best!",1738040166.0,1,t3_1iak4e3,startups
679934223474f2d0be95d626,m9ankoe,[deleted],1737912029.0,0,t3_1iak4e3,startups
679934223474f2d0be95d627,m9b97e6,Go and learn and become technical. Your skills are not good enough to be a founding team unless you are connected or have money,1737918076.0,0,t3_1iak4e3,startups
679934223474f2d0be95d628,m9nwn60,"I am a founder of an IT services company with 15 years of experience. I would suggest you to focus on only 2 things, rest all can be managed.

1. The killer idea that solves the problem and has decent volume
2. Rather focusing on sales focus on marketing. Sales will happen only when you have leads and to get leads you need better marketing skills.

Tech Development you get it done from someone else and later when you have bandwidth hire CTO.",1738083483.0,1,t3_1iak4e3,startups
679934223474f2d0be95d629,m9andkd,Best of luck with your launching :),1737911973.0,2,t3_1iajzeu,startups
679934223474f2d0be95d62a,m9albhf,"hi, automod here, if your post doesn't contain the exact phrase ""`i will not promote`"" your post will automatically be removed.

*I am a bot, and this action was performed automatically. Please [contact the moderators of this subreddit](/message/compose/?to=/r/startups) if you have any questions or concerns.*",1737911384.0,1,t3_1iajzeu,startups
679934223474f2d0be95d62b,m9an89k,"Let me tell you my story and what I am struggling with now. I have so many ideas for business, and I am going to do them, but I am doing two jobs right now, and I don’t have enough time to focus on them. I am planning to save money first, and I want to invest my savings into my business. But my job is not letting me stop it.",1737911930.0,1,t3_1iajzeu,startups
679934223474f2d0be95d62c,m9aw9dq,Keep going 🚀 and good luck with your launch!,1737914486.0,1,t3_1iajzeu,startups
679934223474f2d0be95d62d,m9b0fna,Proud of you sir. 🙏🏻,1737915648.0,1,t3_1iajzeu,startups
679934223474f2d0be95d62e,m9bd4k8,"Congrats, wishing you all the best! 🚀

I'm 2.5 months in to working on mine. Right now I'm really struggling with finding beta testers for my MVP/POC since my target market is pretty niche - do you have any advice on getting through this slump?",1737919177.0,1,t3_1iajzeu,startups
679934233474f2d0be95d62f,m9a91oj,"you’d be surprised how quickly that will turn into karma farming on comments.

I think a better solution is to restrict promotions to one day a week or month.",1737907833.0,7,t3_1iai6px,startups
679934233474f2d0be95d630,m9adhsb,It exists! Reddit.com/advertising,1737909134.0,3,t3_1iai6px,startups
679934233474f2d0be95d631,m9a7aae,"hi, automod here, if your post doesn't contain the exact phrase ""`i will not promote`"" your post will automatically be removed.

*I am a bot, and this action was performed automatically. Please [contact the moderators of this subreddit](/message/compose/?to=/r/startups) if you have any questions or concerns.*",1737907318.0,0,t3_1iai6px,startups
679934233474f2d0be95d632,m9aagmj,"Pre-sell things before you manufacture anything. It’s never been easier to throw up a landing page, push what you’ve created out into the world, and get figure out if there’s a market for it. Athleisure, seems tough. Lulu, fabletics, athletica… but there were 10s of Trainer brands when Phil Knight launched Nike. Copy paste for On-running. But what is key is they had a perspective that was new, or a distribution channel. 

Beyond that, if you’re determined to do this, it’s simply a question of whether you’re willing to do this for the next decade plus. Does the idea of flying around the world to 100s of factories to check the quality of factories sound like fun? How are you going to differentiate on design? Can you? How will you reach buyers? What insight do you have that is unique? Why are you uniquely placed to do it.  

No experience running a business isn’t a big issue IMO. Every first time founder was there at some point. Read a lot. Meet local business people. Find people a couple of steps ahead of you. And don’t be scared to reach out to the key people in your industry and ask for help. You’ll be shocked how often they are willing if you ask good questions.",1737908251.0,4,t3_1iahxxn,startups
679934233474f2d0be95d633,m9a8ee8,Make sure your product it’s wanted,1737907645.0,2,t3_1iahxxn,startups
679934233474f2d0be95d634,m9d6wz4,What you’re talking about isn’t a startup. Checkout r/entrepreneur or r/smallbusiness you’ll get more relevant info,1737937736.0,2,t3_1iahxxn,startups
679934233474f2d0be95d635,m9a5d4c,"hi, automod here, if your post doesn't contain the exact phrase ""`i will not promote`"" your post will automatically be removed.

*I am a bot, and this action was performed automatically. Please [contact the moderators of this subreddit](/message/compose/?to=/r/startups) if you have any questions or concerns.*",1737906754.0,1,t3_1iahxxn,startups
679934233474f2d0be95d636,m9ami6r,Hey buddy! I think our goal is quite similar wanna work together see my reddit if you like . Dm me we can grow together,1737911721.0,1,t3_1iahxxn,startups
679934233474f2d0be95d637,m9am1ca,Do you want to get paid? By its very nature helping startups with no money raise money is a tough gig if you want to make it a living. On top of which some founders that do pay will not be happy unless you raise them money in 30 days (the competent founders do it themselves). But there are some great founders to work with if you can find them (which I am grateful for everyday). Trust me I speak from experience.,1737911588.0,2,t3_1iaeaj0,startups
679934233474f2d0be95d638,m99eewa,"hi, automod here, if your post doesn't contain the exact phrase ""`i will not promote`"" your post will automatically be removed.

*I am a bot, and this action was performed automatically. Please [contact the moderators of this subreddit](/message/compose/?to=/r/startups) if you have any questions or concerns.*",1737897432.0,1,t3_1iaeaj0,startups
679934233474f2d0be95d639,m99oi0e,"None, really.  A few people might look out of curiosity.",1737901322.0,1,t3_1iaeaj0,startups
679934233474f2d0be95d63a,m9c9f0m,"Unless you do it for free, or as part of an incubator (providing advice and getting paid by the incubator itself), this is just a no go for most founders.

I guess a better question would be, would you have paid for coaching when starting, since you have experience raising VC money?",1737928055.0,1,t3_1iaeaj0,startups
679934233474f2d0be95d63b,m9ck5sw,"My apologies for being unclear in my original message. It was something I was thinking of doing sporadically and as a side hustle.

One of the things which prompted me was the fact that fundraising is so much about having networks, and sometimes good founders with good products don't get the opportunities because they literally don't know where to go, or more importantly how to fundraise and how to address their messaging correctly.

I've helped a few startups and founders can become so focussed on their product (as they should) that they lose sight of how to sell this to an investor.",1737931103.0,1,t3_1iaeaj0,startups
679934243474f2d0be95d63c,m997s7r,"I can’t tell if this is satirical, but FWIW I unironically agree with the post title. 

This sub had a very serious problem with self promotion, astroturfing, etc. The new policy may not be great, but it’s at least addressing the root problem. Maybe overtime the sub will get to a healthy state and it can be rolled back. 

All these posts complaining about the policy are annoying. Maybe make a weekly mega post for all the whining.",1737894348.0,30,t3_1iad0ju,startups
679934243474f2d0be95d63d,m99io5h,LOL. I was thinking the same thing this morning. Time will tell and at least the mods are trying something.,1737899140.0,15,t3_1iad0ju,startups
679934243474f2d0be95d63e,m996nea,Meta,1737893767.0,7,t3_1iad0ju,startups
679934243474f2d0be95d63f,m99yoor,"Agreed. Exactly what I’ve been thinking too. 

And, I don’t mind people dropping a link when it’s helpful - such as to a blog vs a wall of text post - but the astroturfing has gotten out of hand.",1737904746.0,2,t3_1iad0ju,startups
679934243474f2d0be95d640,m9968vk,"hi, automod here, if your post doesn't contain the exact phrase ""`i will not promote`"" your post will automatically be removed.

*I am a bot, and this action was performed automatically. Please [contact the moderators of this subreddit](/message/compose/?to=/r/startups) if you have any questions or concerns.*",1737893554.0,1,t3_1iad0ju,startups
679934243474f2d0be95d641,m9a4dmd,"Great, now every title is going to be “My startup experience I will not complain about I will not promote”",1737906461.0,1,t3_1iad0ju,startups
679934243474f2d0be95d642,m9byevm,"I will promote. Buy my onlyfans. I sell pictures of startups only. Real no-code, 20kMRR porn.",1737925100.0,1,t3_1iad0ju,startups
679934243474f2d0be95d643,m9ek0xs,"Next Post - All these tedious ""All these tedious ‘All these tedious ‘I will not promote’ subject lines will be what make me unsub from here’ subject lines will be what make me unsub from here"" is what will make me unsub from here.",1737953939.0,1,t3_1iad0ju,startups
679934243474f2d0be95d644,m9ff04a,"I will not promote, but then again, maybe I will.",1737971365.0,1,t3_1iad0ju,startups
679934243474f2d0be95d645,m99u8c0,This is exactly the type of post that will make me unsubscribe,1737903313.0,1,t3_1iad0ju,startups
679934243474f2d0be95d646,m99h5r6,[deleted],1737898547.0,-2,t3_1iad0ju,startups
679934243474f2d0be95d647,m9f44ls,Babysitting horseshit.,1737964530.0,0,t3_1iad0ju,startups
679934243474f2d0be95d648,m999q8b,"Yes, because these subs and others are a reflection of the Zeitgeist. I have been banned and cancelled already in two groups just by practicing critical thinking. I have never seen social causes that behave so anti social. 

I don't know how others navigate social media for their startup and side projects, but target groups are gate kept to whining venues. Silly subs are a symptom of that. Or too much automation.",1737895313.0,-6,t3_1iad0ju,startups
679934243474f2d0be95d649,m99eb2f,"I'm working on something I really am passionate about. I wouldn't choose anything else to work on.

Learning new things is a big dopamine hit for me and keeps me going.

Positive user feedback and interactions also keeps me going - signal that what I'm doing is valuable to people.

Staying grounded instead of focusing too much on investors, advisors, or events, or even necessarily growth. Don't compare to anyone. You can reference, but every startup has unique circumstances.

Theres always stress and I embrace it as a driver for growth. When it piles up high enough it's usually a sign I need to learn something. When I learn that thing, the stress goes away again.

Doing hard things will never be painless. It's part of the deal.

Also long walks in nature are super nice.

I've usually hit burnout before when my actions weren't leading to results, and I wasn't learning new things. I felt stuck. Or when I felt stuck due to co-founder relationships. Or when I put too much focus on how investors thought about my business. Or when I ran out of money and it was time to call it quits.

Of course a startup is ""never ending"". We're building value for people, and there's always lots more value we can add. You really can't be in this thinking about the ""end point"".  Maybe ask yourself why you're thinking of it as a race? 

This is a lifestyle, not a temporary program. This isn't the rat race. The rat race was going to a job I didn't really love and daydream of working on my own projects or where I'd go on the weekend. That race was circular and the clock reset every monday.

My startup gas is curiosity and the drive to build the solutions I want for my problems. It's smiles on others faces when I help them achieve their goals. It's learning more everyday about how the world works.",1737897387.0,6,t3_1iacu29,startups
679934243474f2d0be95d64a,m9lc6tw,"The trick is to enjoy it. 

Whenever I have to stay up late working on a project and the dread or tiredness sets in I just take 30 minutes to do a quick workout and it feels like it's morning all over again. 

Stressing over lack of sleep is worse than the actual lack of sleep. As long as you don't do it every day it's fine but it's really not that bad if you catch up on it eventually.",1738042852.0,3,t3_1iacu29,startups
679934243474f2d0be95d64b,m99p9la,"I got burned out long ago but, for me, I am now unemotional and pace myself.  Don’t get too high or too low.",1737901597.0,2,t3_1iacu29,startups
679934243474f2d0be95d64c,m9ak66t,"I'm 3 years in - after 32 years working for ""the man.""  No burnout in sight, though I do worry if my co will make it.  If I were feeling burnout I'd just think back on office politics and dirty tricks.  That'd put me right back in the founder mindset.",1737911052.0,2,t3_1iacu29,startups
679934243474f2d0be95d64d,m9cikxr,What exactly are you doing that is stressing you out?,1737930646.0,2,t3_1iacu29,startups
679934243474f2d0be95d64e,m9gcyk6,"What worked for me is my daily 5KM walk, no coffee after 3 PM, taking frequent breaks from the desk and work in general. I know I have the privilege of taking a few days off and driving to the closest hill station for some R&amp;R. I wish to add exercise to this routine. Sleeping on time and waking up on a schedule also helps. 

I built an 8 figure business with a partner in the past and that was stressful but that led to doing it better, right and relatively stress free this time around.",1737987264.0,2,t3_1iacu29,startups
679934243474f2d0be95d64f,m9hdq97,"I've definitely been there too. Burnout is no joke for founders, especially when you're running a startup that feels like a never-ending race. Here's my experience:

1.Burnout hit me hardest about 2 years into my entrepreneurship journey. I was trying to do everything myself, working 80+ hour weeks, and neglecting my health and relationships. It felt like I was sprinting a marathon.

2.What actually helped:

- Learning to delegate and build a support network
- Implementing strict boundaries around work hours 
- Focusing on physical health (sleep, exercise, nutrition)
- Regular breaks and time completely disconnected from work
- Finding ways to reconnect with my ""why"" and passion

What was BS:
- ""Hustle harder"" mentality 
- Thinking I could power through it
- Quick fixes like productivity hacks or apps

3.My blind spot was thinking I had to do it all myself and that asking for help was a sign of weakness. I had to learn that building a strong team and support system is crucial.

Some resources that helped me:
- ""Deep Work"" by Cal Newport for focus and time management
- ""Essentialism"" by Greg McKeown for prioritization
- Therapy/coaching for stress management

Remember, sustainable growth is better than burning out. Take care of yourself - you're the most important asset in your business.

Disclosure: I'm the founder of Scattermind, where I help ADHDers become full-time entrepreneurs. While I specialize in ADHD, these burnout challenges are common for many founders.",1737998172.0,2,t3_1iacu29,startups
679934243474f2d0be95d650,m9955cw,"hi, automod here, if your post doesn't contain the exact phrase ""`i will not promote`"" your post will automatically be removed.

*I am a bot, and this action was performed automatically. Please [contact the moderators of this subreddit](/message/compose/?to=/r/startups) if you have any questions or concerns.*",1737892968.0,1,t3_1iacu29,startups
679934253474f2d0be95d651,m994e0p,"As a rule of thumb, if you’re outsourcing marketing in the early stage, you’re doing it wrong.",1737892554.0,4,t3_1iacnqp,startups
679934253474f2d0be95d652,m999pro,"I hear you loud and clear. It’s such a common frustration. When I was in the thick of startup mode, finding an agency that got it was like searching for a needle in a haystack. They all talk about shiny, feel-good metrics like ‘vanity metrics,’ right? Followers or likes or whatever. But when it came down to hardcore revenue growth and ROI, it just felt like they fell short.

I actually ended up switching gears. Instead of hiring another agency, I started focusing more on building a small in-house team. It was tough initially, getting people who genuinely went after revenue growth but eventually we figured it out. I found that sometimes hiring enthusiastic and adaptable people directly, and training them with a clear focus on revenue goals, made a huge difference. It took time, but the impact was more direct.

I also made it a point to tie our marketing campaigns back to sales metrics, almost obsessively. I’m talking regular meetings with the sales team and constant feedback loops to really drive that alignment between marketing efforts and sales outcomes. 

Anyone else navigating the same struggle or found a killer agency that turns marketing into moolah? It’s a conversation we need to have more often, I feel.",1737895307.0,3,t3_1iacnqp,startups
679934253474f2d0be95d653,m9ai29n,"Marketing....cares about revenue...or sales...?

What companies have y'all been at?",1737910446.0,2,t3_1iacnqp,startups
679934253474f2d0be95d654,m9d9c3v,"100% agree with this.  Its an opportunity to launch a start up in the martech space.  Which i am currently doing. Revenue is king! 

Fyi awareness is easier  than producing actual revenue",1737938471.0,2,t3_1iacnqp,startups
679934253474f2d0be95d655,m9lhkmo,"Big questions is if you want revenue why are you hiring brand marketers and content marketers those are literally the longest tail type of return from marketing. 

I do marketing and what you are looking for are direct response marketers, lead generators, outbound specialists and demand generation specialists because those are positions tied to ROI.

The more you want to generate money from marketing the more you need to bring it closer to the sales team.",1738045540.0,2,t3_1iacnqp,startups
679934253474f2d0be95d656,m9943o8,"hi, automod here, if your post doesn't contain the exact phrase ""`i will not promote`"" your post will automatically be removed.

*I am a bot, and this action was performed automatically. Please [contact the moderators of this subreddit](/message/compose/?to=/r/startups) if you have any questions or concerns.*",1737892391.0,1,t3_1iacnqp,startups
679934253474f2d0be95d657,m99545p,"Of course they don't if you are focusing on the wrong ones. There's 2 sides to this:

1) Companies that only want revenue don't run long, become toxic and unbearable to marketers, and pretty much put everyone 10 steps behind.

2) Marketing as a core is way more about traction, if you want conversion you have to focus on niches that offer that. Even then, there will never be a pure 100% money making scheme because to sell you need trust and for trust you need marketing.

So either focus on hiring sales reps or get a marketing guy, yes 1 guy who has a deep focus on how to scale first with specialized strategy and then diversify as you grow. 

P.S - if you only hire sales reps you will face low conversion there as well because you never built any brand recognition or brought in inbound",1737892950.0,1,t3_1iacnqp,startups
679934253474f2d0be95d658,m9bi0o7,"No, they don't, because generating revenue is very complicated and depending on your business model, it can be potentially hard to track.",1737920550.0,1,t3_1iacnqp,startups
679934263474f2d0be95d659,m994daz,"I would say always try to be the least smart person in the room. Don’t let pride or arrogance stop you from taking advice from others, especially in the parts of business that are new to you, but always do due diligence on that advice.",1737892543.0,8,t3_1iack5f,startups
679934263474f2d0be95d65a,m99binq,"Be a critical thinker:)

The world is filled with bad advice, either because they're created by people with a lack of experience who wanna sound motivational or because it's just not applicable to you.",1737896159.0,6,t3_1iack5f,startups
679934263474f2d0be95d65b,m99chtx,"Be a problem solving machine.

And, making mistakes is completely fine, make sure you learn from them.",1737896603.0,5,t3_1iack5f,startups
679934263474f2d0be95d65c,m993ha3,"hi, automod here, if your post doesn't contain the exact phrase ""`i will not promote`"" your post will automatically be removed.

*I am a bot, and this action was performed automatically. Please [contact the moderators of this subreddit](/message/compose/?to=/r/startups) if you have any questions or concerns.*",1737892041.0,2,t3_1iack5f,startups
679934273474f2d0be95d65d,m98zvyn,"Well my experience so far is seeing far more discussions around actual startup issues. Which is why I joined the sub in the first place.

I nearly unsubbed due to the abundance of thinly veiled promo and bot-like posts.

I'm not sure why the extra sentence is bothering you so much. Could you clarify? I'm not experiencing your issue and so can't intuit the reasoning on your behalf.",1737889956.0,113,t3_1iabm8x,startups
679934273474f2d0be95d65e,m9abvbs,100% agree. Why not require the phrase to be in the post body instead of the subject line?,1737908664.0,10,t3_1iabm8x,startups
679934273474f2d0be95d65f,m98zeax,"&gt;whose idea it was or what happened to prompt it

Check multiple posts from yesterday, 2 days ago, 3 days ago then you will know what’s the reason. Actually now I’m more tired of reading people still asking why why why when this just happened recently and been explained so many times here",1737889660.0,26,t3_1iabm8x,startups
679934273474f2d0be95d660,m992393,"I prefer that to all of the self promotion posts, honestly the other startup-related subs should do the same ",1737891244.0,40,t3_1iabm8x,startups
679934273474f2d0be95d661,m9924p1,Well... bye.,1737891267.0,23,t3_1iabm8x,startups
679934273474f2d0be95d662,m99591o,Personally I’m a huge fan of it. This sub was 95% self promotion previously. ,1737893024.0,11,t3_1iabm8x,startups
679934273474f2d0be95d663,m992k1a,"no, fuck self promotion",1737891511.0,24,t3_1iabm8x,startups
679934273474f2d0be95d664,m9968p5,Maybe we should create a new startup reddit for those who want to promote,1737893551.0,10,t3_1iabm8x,startups
679934273474f2d0be95d665,m99uqh4,This is your first contribution to this sub in 9 years. Threatening to leave a sub you don’t contribute to is kind of hilarious.,1737903481.0,13,t3_1iabm8x,startups
679934273474f2d0be95d666,m98y2i6,"hi, automod here, if your post doesn't contain the exact phrase ""`i will not promote`"" your post will automatically be removed.

*I am a bot, and this action was performed automatically. Please [contact the moderators of this subreddit](/message/compose/?to=/r/startups) if you have any questions or concerns.*",1737888863.0,6,t3_1iabm8x,startups
679934273474f2d0be95d667,m9965yp,"Maybe they are waiting for all the bots to start putting ""I will not promote"" in their code, then the mods will flip it to filter it out.",1737893510.0,6,t3_1iabm8x,startups
679934273474f2d0be95d668,m996c6d,https://www.reddit.com/r/startups/s/bMgP1vDY86,1737893602.0,3,t3_1iabm8x,startups
679934273474f2d0be95d669,m9bg73w,"Except anything related to this sub get's filled with dogshit fake stories and shitty self promotion. I unsubbed from /r/entrepreneur because of the frequency of fake stores and bad advice. 

The other problem is tho, when trying to start a discussion lots of things go unnoticed or straight downvoted.",1737920038.0,3,t3_1iabm8x,startups
679934273474f2d0be95d66a,m9cenzi,It was my idea. I was tired of banning everyone for self-promotion. Now I don't have to ban as many people.,1737929528.0,3,t3_1iabm8x,startups
