_id,id,body,created_utc,score,parent_id,subreddit
679957d3bc2da607061692a5,m8nht7j,no.. you dont have product or money.. pattern only big folks guy,1737597656.0,1,t3_1i7pkui,startups
679957d3bc2da607061692a6,m8oakqa,"Patent search first, then consult.",1737608038.0,1,t3_1i7pkui,startups
679957d3bc2da607061692a7,m8occ8r,"No one can patent an idea.  But they can patent IMPLEMENTATIONS to achieve certain outcomes. 

Focus on making your project as successful as possible.

Once you achieve that, you would have enough $$$ to redesign your product's implementation should a patent already exist for your particular implementation.",1737608788.0,1,t3_1i7pkui,startups
679957d3bc2da607061692a8,m8ouo82,Its better to not even check for a patent than to know there is one.,1737618116.0,1,t3_1i7pkui,startups
679957d3bc2da607061692a9,m8p4s0z,"Unless your idea is truly groundbreaking and will revolutionize whatever space you happen to be in then chances are you could probably skip the patent for now. The chances of a truly unique product are very slim. Chances are, a version of whatever it is you're making exists in a slightly different way elsewhere.
This isn't meant to put down the idea... I think the way most people go about product ideas seems a bit backwards to me.
Try to position your product in-between their services to hit the pain points similar services night have overlooked.
Actually use the competition and their services so you know first hand what you're up against 

I hope this helps, and again this wasn't to discourage but to give you an alternative way of thinking about it",1737624407.0,1,t3_1i7pkui,startups
679957d3bc2da607061692aa,m8pdve8,"\&gt; But do I need to talk with a patent lawyer and figure out how to do that so I’m not infringing on any patents before I start selling?

I have a patent, and a pretty badass one.

Go to patents google com (links are banned I believe), and look for your solution, at least 5 full-time days. You probably can come up with ways of naming your patent yourself.",1737630004.0,1,t3_1i7pkui,startups
679957d3bc2da607061692ab,m8wjk2t,"if it is a tech product idea-- do not even think of patent problems or benefits, at least not at this stage.  
If someone has a patent on your idea, they must have built a product or technology using that. if it does not exist? then it's not such a good tech or idea.  


My advise: Just work on your stuff. IGNORE the patent stuff",1737723965.0,1,t3_1i7pkui,startups
679957d4bc2da607061692ac,m8mgw9n,Who is your customer; what problem are you solving; and how will you make money? That's what you need to know. Don't get bogged down in thinking about too much. You can expand your analysis after you break these three things down.,1737585956.0,2,t3_1i7o6ae,startups
679957d4bc2da607061692ad,m8mfgbj,"hi, automod here, if your post doesn't contain the exact phrase ""`i will not promote`"" your post will automatically be removed.

*I am a bot, and this action was performed automatically. Please [contact the moderators of this subreddit](/message/compose/?to=/r/startups) if you have any questions or concerns.*",1737585516.0,1,t3_1i7o6ae,startups
679957d4bc2da607061692ae,m8p6l2v,Thank you guys! It mean a lot to hear some advices,1737625568.0,1,t3_1i7o6ae,startups
679957d4bc2da607061692af,m8o7h36,[removed],1737606756.0,0,t3_1i7o6ae,startups
679957d4bc2da607061692b0,m8mg254,"don't get a cofounder just for the creds. if you build a product people want, you'll be good",1737585699.0,5,t3_1i7n1h7,startups
679957d4bc2da607061692b1,m8m8rik,"Make a business plan and try to get early investors on board. Better chance getting money early from friends, family , co workers etc… you really need to sell it and show you are serious nobody will hand you a dollar with just an idea",1737583523.0,3,t3_1i7n1h7,startups
679957d4bc2da607061692b2,m8nq308,The first thing you should do is either consult with him again and make a proposal for the tech idea + the whole development pipeline + architecture. If he isn’t willing to cause he is busy then you can meet a tech consultant like me or someone else here and they can draft you one so you can atleast understand how to build it and get investor funding for the proposal. This way all you do is manage + market while you find someone who can join but as an employee so in the future the business belongs to you + some shares from investors,1737600432.0,2,t3_1i7n1h7,startups
679957d4bc2da607061692b3,m8pfdca,"You don’t need a team.  Build an mvp.  You can do that with one person.  Look them in the face when you work with them.  Don’t fall for the cheap outsourcing schtick, it doesn’t work for someone like you.",1737630857.0,2,t3_1i7n1h7,startups
679957d4bc2da607061692b4,m8m5mq1,"hi, automod here, if your post doesn't contain the exact phrase ""`i will not promote`"" your post will automatically be removed.

*I am a bot, and this action was performed automatically. Please [contact the moderators of this subreddit](/message/compose/?to=/r/startups) if you have any questions or concerns.*",1737582659.0,1,t3_1i7n1h7,startups
679957d4bc2da607061692b5,m8oo7j7,Connect with an Indian dev,1737614499.0,1,t3_1i7n1h7,startups
679957d4bc2da607061692b6,m8orhc8,Search for the best person out there. You are not in a hurry but a tech guy can help you improve your product.,1737616270.0,1,t3_1i7n1h7,startups
679957d4bc2da607061692b7,m8p149n,"A well crafted prototype on Figma takes almost nothing to learn and allows you to showcase your idea to potential devs or otherwise who might want to do an equity partnership if the vision is strong enough 
In my opinion, the order should go:

Prototype 
Pre seed funding
Find first team member who can take on the development (try for a full stack dev) on an equity based partnership unless you back hiring expenses into the pre seed ask.

At this point you'll have more flexibility in getting the right co-founder and not just someone who's good at tech 
A co-founder should be well rounded but operating within their strengths and most importantly should have a keen eye for your vision while being able to add meaningfully to the roadmap 

Hope this helps, Id love to know more about what you're working on as I am in the same boat of looking for early team members. So everything i explained to you is exactly how I'm going about it",1737622065.0,1,t3_1i7n1h7,startups
679957d4bc2da607061692b8,m8wgk8f,"To be honest, once the app is deployed. It doesn’t need much to hire a tech guy on monthly basis as it will be your initial stage of journey. I did 5 jobs and I charge them a very decent amount.",1737722774.0,1,t3_1i7n1h7,startups
679957d4bc2da607061692b9,m8xpgt5,Sent you a DM,1737736937.0,1,t3_1i7n1h7,startups
679957d4bc2da607061692ba,m992ira,"I am a tech CEO with $100m in exits and love talking shop. 

Shoot me a message if you want and I'll see what I can do to guide you. 

I want no money or stock, not promoting.",1737891490.0,1,t3_1i7n1h7,startups
679957d4bc2da607061692bb,m8nokm3,Are you at all comfortable with your pc? You'd be astounded how quickly you can use AI to assist with coding stuff and get a MVP or at least a working prototype with very little programming knowledge. Plus you'd learn a new skill which is nice.,1737599920.0,0,t3_1i7n1h7,startups
679957d4bc2da607061692bc,m8lq2wb,"Yes, though the rules are a bit finnicky (for capital losses in general) [https://www.investopedia.com/articles/personal-finance/100515/heres-how-deduct-your-stock-losses-your-tax-bill.asp](https://www.investopedia.com/articles/personal-finance/100515/heres-how-deduct-your-stock-losses-your-tax-bill.asp)",1737578523.0,3,t3_1i7l8yd,startups
679957d4bc2da607061692bd,m8lpe7h,"Not a tax advisor or lawyer, but yes you should be able to write that off as a loss.",1737578341.0,2,t3_1i7l8yd,startups
679957d4bc2da607061692be,m8lpxo3,"Yes, it's a capital loss.  It would offset any capital gains plus up to $3k of ordinary income, with any unused balance being carried over.  Just as if you'd sold public company shares for a loss.  Report it on your taxes as sold for $0 or tell your accountant.  

I'm not an accountant, but there may be a documentation standard for the company actually being liquidated and/or your having formal notice that your shares have been cancelled or are otherwise worthless.",1737578485.0,2,t3_1i7l8yd,startups
679957d4bc2da607061692bf,m8lopmc,"hi, automod here, if your post doesn't contain the exact phrase ""`i will not promote`"" your post will automatically be removed.

*I am a bot, and this action was performed automatically. Please [contact the moderators of this subreddit](/message/compose/?to=/r/startups) if you have any questions or concerns.*",1737578158.0,1,t3_1i7l8yd,startups
679957d4bc2da607061692c0,m8lt7lw,which company if I may ask? sad to hear of the situation.,1737579351.0,1,t3_1i7l8yd,startups
679957d4bc2da607061692c1,m8lxox2,"Yeah, capital loss that can be used to offset capital gains.",1737580546.0,1,t3_1i7l8yd,startups
679957d4bc2da607061692c2,m8obsis,"IRS liquidating distribution and capital loss rules. The former if it's nearly worth zero and the latter if it's totally worth zero. You have to devalue it $3,000 per year and carry over years until it zeroes out. 

https://www.irs.gov/faqs/capital-gains-losses-and-sale-of-home/losses-homes-stocks-other-property/losses-homes-stocks-other-property-1",1737608551.0,2,t3_1i7l8yd,startups
679957d4bc2da607061692c3,m8odkmy,Is this the same situation with phantom units?,1737609328.0,1,t3_1i7l8yd,startups
679957d5bc2da607061692c4,m8lo12o,"Good analysis but I won’t stick to my day job that gives me 3K a month. 
I agree trying to make 100k monthly with your startup sounds foolish but at least 4k is doable. 
I believe in my capabilities and even if I fail in this one I will try again because failure it’s temporary as long as I keep learning and iterating.
Also it looks better on my CV than a medium management low payment job.",1737577976.0,52,t3_1i7j5qk,startups
679957d5bc2da607061692c5,m8ldojh,"Seems like a lot people overlook the fact that over 90% of startups fail. Somehow they don't sense the long odds and go for it anyway. 

Interestingly, there are a couple big reasons startups fail, and you can evaluate these prior to spending significant time and money on a startup:

1) Do you or do you not have customer validation? Where validation means they actually took out and swiped their credit card to pay for your offering. Until you have validation, it is just theory.

2) Is the timing good? Often a good idea is too soon for the market. For example, I don't think you could have started a ride share or short term rental offering back in 1994, not because it wasn't a good idea, but you need the internet to make it work at any kind of scale. 

There are many other reasons startups fail, such as lack of funding, poor management, cofounder riffs, competitive pressure, supply chain issues, etc., etc., etc., but these are all after you've started.

Unless you have rock solid answers to 1 and 2 above, stick with your day job.",1737575176.0,14,t3_1i7j5qk,startups
679957d5bc2da607061692c6,m8ld9mb,There is certainty in having a job? Asking from a ‘right to work’ state.,1737575066.0,16,t3_1i7j5qk,startups
679957d5bc2da607061692c7,m8lvf8u,"You're missing the hope and dreams part. In a job you can just feel stuck in a loop. Sure the expected financial value might be better, but yolo",1737579944.0,9,t3_1i7j5qk,startups
679957d5bc2da607061692c8,m8liled,"I didn't lower my salary from my startup compared to what I earned at my previous job. Right now I kept it the same, but planning to increase it as I get more revenue",1737576494.0,3,t3_1i7j5qk,startups
679957d5bc2da607061692c9,m8m3uzb,"You should 'start up' if you value independence. Wealth does not come before 40, at least it doesn't stay before 40 and that requires a lot of saving and smart investing, regardless if you own a company or not.

If you're in the game for wealth and fame, then you're better off sticking to your job and doing some comedy stunts on TikTok as a side gig or hobby.

If you're in for independence, enjoy playing lego and can handle fluctuations in income, you're here to stay. You need that ambition and some grit. You fall on your face, you get back up. Each time you eff up, you get even more pissed so you want to build something better. It's like a game.",1737582183.0,3,t3_1i7j5qk,startups
679957d5bc2da607061692ca,m8mtt4w,There is no certainty in jobs either,1737590036.0,3,t3_1i7j5qk,startups
679957d5bc2da607061692cb,m8nc20j,"The ROI of investing in yourself to build a company and the professional growth that comes from that is arguably greater than the growth you’d see in many other enterprises. 

I’ve been part of a large F100 company and a very small startup and the years of experience in the startup were worth 10x more than the large company. Is the NPV of lower pay earlier a net negative, maybe?  But I’d bet lots of people end up in positions they never would have otherwise without the startup",1737595804.0,3,t3_1i7j5qk,startups
679957d5bc2da607061692cc,m8lagk4,"Except that nowadays, it is possible for founders to cash out at earlier timeframes, especially if a company can get to an IPO within 5 years. And, you can include some salary plus equity as a founder &amp; CEO. 
It’s not for everyone, though, and the natural history of far too many startups is failure, often due to poor leadership and poor execution on otherwise good ideas.",1737574318.0,6,t3_1i7j5qk,startups
679957d5bc2da607061692cd,m8n1dbf,"All that is well and good. 

How about when you hit age discrimination?",1737592410.0,2,t3_1i7j5qk,startups
679957d5bc2da607061692ce,m8n5dad,Yes way better to work for a company who will lay you off after 6 months!,1737593675.0,2,t3_1i7j5qk,startups
679957d5bc2da607061692cf,m8n5uzg,"Yes. I went to a very prestigious undergrad with really smart kids all around. The only founders who made it big in their 20s - early 30s all had upper middle class backgrounds at least matching Mark Zuckerberg or Bill Gates's families, I.e. lawyers, wealthy doctors, business people. 


There were equally driven and high IQ 1st gen immigrants or children of poor scientists who mostly decided to into finance or software engineering or consulting first. Some of these folks in their mid 30s are now pursuing entrepreneurship as they have a safety blanket. Note that Jeff Bezos falls solidly into this ladder camp. 


His adoptive parents had modest financial backgrounds, but he was smart and worked at friggin DE Shaw for a decade where he even met the mother of his children, a Princeton grad working as an administrative assistant. Only when Bezos already had enough of a nest egg did his family pivot to trying Amazon.",1737593830.0,2,t3_1i7j5qk,startups
679957d5bc2da607061692d0,m8n8tob,"i think you should get a job if you already don't have one instead of going to people who are actually trying to do something and asking them these questions and judging people's efforts, stop telling people how to live their lives",1737594770.0,2,t3_1i7j5qk,startups
679957d5bc2da607061692d1,m8nllj6,"Lol too many words. I will keep it simple: most people should simply just get a job because building a company is hard, time consuming and luck driven with more chances of failure than success",1737598911.0,2,t3_1i7j5qk,startups
679957d5bc2da607061692d2,m8p8154,"There can be a balance.  Can keep your day job while you build your startup.  This doesn't apply to all startups, but in general it's probably the best hedge.",1737626485.0,2,t3_1i7j5qk,startups
679957d5bc2da607061692d3,m8pdv94,You try to build a startup for wealth or independence. I build startups because I am bored. We are not the same,1737630002.0,2,t3_1i7j5qk,startups
679957d5bc2da607061692d4,m8sxemn,"The founder of Instacart had 20 failed businesses before his last one became a billion dollar company. 

To be honest it really is just a matter of how bad you want it.

I really don't understand the point of this post. This is like going to some athletic competition and asking people why they are competing when only one of them is going to win.",1737669712.0,2,t3_1i7j5qk,startups
679957d5bc2da607061692d5,m8l78wk,"I completely agree.  If you want independence, start a company.  If you want to get rich, don't start a company.",1737573462.0,3,t3_1i7j5qk,startups
679957d5bc2da607061692d6,m8lxebc,Personally I am starting a business to help people feeling better. To open eyes. To help them to get out from under the overlord's boots. Money is a bonus I will take. But there are so much corruption and we need to start a parallel economy among other things. Be our banks and so on.,1737580469.0,3,t3_1i7j5qk,startups
679957d5bc2da607061692d7,m8lgjlx,"I think about 4 out of 5 millionaires are people with jobs.

If you have what it takes to get rich by building a company, you’re more likely to get rich with the resources and safety net of a big company that already exists.

And freedom? There a lot of freedom if you’re a C-suite in a big company. 

Zero freedom as a founder - you’re married to the company, and need to babysit it 24/7. You’re the only one really responsible. 

I think a lot of us start companies because we can’t hold a job.",1737575937.0,3,t3_1i7j5qk,startups
679957d5bc2da607061692d8,m8l5yhk,"hi, automod here, if your post doesn't contain the exact phrase ""`i will not promote`"" your post will automatically be removed.

*I am a bot, and this action was performed automatically. Please [contact the moderators of this subreddit](/message/compose/?to=/r/startups) if you have any questions or concerns.*",1737573116.0,1,t3_1i7j5qk,startups
679957d5bc2da607061692d9,m8mejwf,Depressing insight,1737585244.0,1,t3_1i7j5qk,startups
679957d5bc2da607061692da,m8my6x7,"Some things in life are about more than money. Having regret later in life from playing it safe might not be worth any amount of money to some.

Personally, I'd rather give it a shot and learn a ton of things most people never would. If I have to retire 5 years later, so what. I can definitely find jobs I like and are interesting to me. I'm not really one to rest on my laurels anyway.",1737591413.0,1,t3_1i7j5qk,startups
679957d5bc2da607061692db,m8nqdrj,You are 100% right.,1737600531.0,1,t3_1i7j5qk,startups
679957d5bc2da607061692dc,m8pe4ny,Read The Great Rat Race Escape to not make dumb mistakes and you'll be fine off. This is misleading.,1737630153.0,1,t3_1i7j5qk,startups
679957d5bc2da607061692dd,m8pjnqk,hm,1737633136.0,1,t3_1i7j5qk,startups
679957d5bc2da607061692de,m8pjvxo,Lucky that I have managed to finally find something that helps me a bit. Even if it's just a start for now,1737633247.0,1,t3_1i7j5qk,startups
679957d5bc2da607061692df,m8pkktu,"Yes it's true that many people give up when trying to boluild their own brand and business.  

Best advice I can give is just be consistent.  Each and every day. Even if it's just for 10 minutes a day that you work on your brand/business. 

I have been consistent for little under 2 months now, I hit my 1st 1 million views on a video 3 days ago",1737633578.0,1,t3_1i7j5qk,startups
679957d5bc2da607061692e0,m8qxlg6,"It would be nice if you could give us some numbers. I think many would already be in agreement with your original statement.

However, if you were to say out of the 1000 I've talked to, 10 are still alive and only 5 are profitable, etc... that would help bring the message home.

Do you have any data to share?",1737650133.0,1,t3_1i7j5qk,startups
679957d5bc2da607061692e1,m8r9jz2,"I've worked directly with/for something like 15 startup leaders and interviewed/spoken with hundreds or thousands more founders. 

The difference between the ones that make it is the CEO, they're tolerance for financial risk and ability to make money.   
  
And by ""make money,"" I mean get paying customers (obviously) OR put money into the company (sometimes seemingly out of thin air). 

They treat the business like their baby and put it before anything. It's honestly, ridiculous sometimes. 

They also keep the business open to pivots—constant small pivots as well as big sweeping changes. Designing it to be responsive and resilient is another big part of survival.   
   
Most of the time, that's what it takes to reach product market fit.",1737653412.0,1,t3_1i7j5qk,startups
679957d5bc2da607061692e2,m8tj06s,"I tried to build an arch design business in San Diego for 4 years.. I made 150-200k per year but it was exhausting. It also made me realize that I hate servicing clients. 

Because I learned that I don’t like the service side, it pointed me towards developing my own properties, the bank is my client… 

I am working to get my GC license and as a CM for a huge contractor company in Santa Rosa Beach,FL. This will give me the money to start this next venture. 

Point is, everyone thinks it’s a straight line to success, it’s not, it’s a wiggly path but don’t give up",1737676176.0,1,t3_1i7j5qk,startups
679957d5bc2da607061692e3,m8uvxxk,"once you have customers and employees you don't have the precious ""independence"".  Most people don't get that.",1737692997.0,1,t3_1i7j5qk,startups
679957d5bc2da607061692e4,m8xjsuw,You can fail just as easily playing it safe,1737735386.0,1,t3_1i7j5qk,startups
679957d5bc2da607061692e5,m9c8isw,Hold the phone. You’re saying most founders launch for money or independence? Not because of unlimited passion and convenient personal experience narrative that led them to divinely solve a very specific problem with software?!???!?,1737927808.0,1,t3_1i7j5qk,startups
679957d5bc2da607061692e6,m8l8cyn,shit that's the missing piece..  is it too late to be gay fucked by my adopted parents?,1737573756.0,6,t3_1i7j2wj,startups
679957d5bc2da607061692e7,m8lazvt,"Then a Mormon gay, immigrant, pro gamer, adopted by a difficult family it's like the pro-ultra-mega-super-iperfounder",1737574463.0,4,t3_1i7j2wj,startups
679957d5bc2da607061692e8,m8l8h37,"I think low impedance neurodivergence is a common trait. Things like dyslexia or aphantasia. I think similar things like narcissism is also (sadly) helpful.

These things have similar effects as your list - forcing you to adapt early, creating a different model of the world, etc. 

There is also weirder stuff like toxoplasmosis that might make you a bigger risk taker.",1737573787.0,3,t3_1i7j2wj,startups
679957d5bc2da607061692e9,m8l8vh6,sounds right...,1737573894.0,2,t3_1i7j2wj,startups
679957d5bc2da607061692ea,m8l59az,"hi, automod here, if your post doesn't contain the exact phrase ""`i will not promote`"" your post will automatically be removed.

*I am a bot, and this action was performed automatically. Please [contact the moderators of this subreddit](/message/compose/?to=/r/startups) if you have any questions or concerns.*",1737572927.0,1,t3_1i7j2wj,startups
679957d5bc2da607061692eb,m8ldyma,One wonders whether Mr. Sivulka invests according to his thesis? Or whether there is some confusion about correlation vs causation?,1737575250.0,1,t3_1i7j2wj,startups
679957d5bc2da607061692ec,m8m7oir,"Motivation and personality type are key.

Most successful founders are:

* Open to risk taking - the higher the risk, the higher the potential gain, so yes, gamers and builders
* High functioning sociopaths and people with ADHD, autism, who do not care about what others think / low regard for society and their judgement
* People with consistent motivation that does not get turned off or blocked easily, such as a persistent problem that needs to be solved, some type of obsessive behaviour

You can also add female founders to this list. Bumble only happened because of a dispute.  
Like when 10 guys eff you over, you get resentful. Or when you hit rock bottom because of resentment, you go from Walter White to Heisenberg.",1737583215.0,1,t3_1i7j2wj,startups
679957d5bc2da607061692ed,m8o3x59,Bait used to be believable.,1737605341.0,1,t3_1i7j2wj,startups
